{
  "caption": "Classification",
  "description": "The attributes that identify the event category and class.",
  "annotations": {
    "group": "classification"
  },
  "attributes": {
    "activity_name": {
      "requirement": "optional"
    },
    "activity_id": {
      "$include": "enums/defaults.json",
      "requirement": "required"
    },
    "category_name": {
      "requirement": "optional"
    },
    "category_uid": {
      "enum": {
        "99": {
          "caption": "Other"
        }
      },
      "requirement": "required"
    },
    "class_name": {
      "requirement": "optional"
    },
    "class_uid": {
      "enum": {
        "99": {
          "caption": "Other"
        }
      },
      "requirement": "required"
    },
    "type_name": {
      "requirement": "optional"
    },
    "type_uid": {
      "requirement": "required"
    }
  }
}
